{
  "schema_version": "1.0",
  "task_id": "hello-world-task",
  "iteration": 2,
  "status": "completed",
  "environment": {
    "operating_system": "linux",
    "python_version": "3.10.20",
    "working_directory": "/work/users/yun79/sideHustle2/copperheadV2",
    "git_commit": "2d3e52d3a88b9d7bab95b99b5783bd66e1c08d81",
    "dirty_worktree": true
  },
  "commands": [
    {
      "command_id": "run-001",
      "command": "python3 -m pytest .agent-system/examples/hello-world-task/tests/test_text_utils.py -q",
      "started_at": "2026-07-21T00:33:10Z",
      "finished_at": "2026-07-21T00:33:11Z",
      "duration_seconds": 0.7,
      "exit_code": 0,
      "timed_out": false,
      "stdout_summary": "....                                                                     [100%]\n4 passed in 0.13s",
      "stderr_summary": "",
      "generated_artifacts": [],
      "classification": "success"
    }
  ],
  "summary": {
    "passed": 4,
    "failed": 0,
    "blocked": 0,
    "incomplete": 0
  },
  "limitations": []
}
